{
  "as_of_date": "2026-08-13",
  "candidate_relation": "knowledge_gap",
  "candidate_support_state": "candidate_reported_match",
  "decision_basis_code": "provider_evidence_missing",
  "done_when": "A current official source exists or the decision remains deferred.",
  "draft_only": true,
  "eligible_provider_choices": [],
  "locale": "en",
  "no_external_action": true,
  "outcome_boundary": "not_an_interview_offer_salary_or_hiring_prediction",
  "privacy_boundary": "identity_free_structured_eligibility_only",
  "private_deliverable": "One private note of the missing provider evidence.",
  "public_vacancy_ordinal": "V2",
  "recommended_next_action": "no_learning_yet",
  "recurrence": "2/4",
  "schema_version": "career-next-action-eligibility-v1",
  "selected_provider_option_id": null,
  "selected_signal": "terraform",
  "selected_vacancy_id": "V-003",
  "source_alignment_snapshot": "snap-alignment-sha256-104d247a0d5a90a070292e1d102d79f1a6cc8de0c15ff9a9214298811f7af6eb",
  "source_dossier_snapshot": "snap-dossier-sha256-4421cc64f2bca782e998ab2f9488be928bf4f27a0e9bb9a706e0abdde0485b03",
  "source_gap_assessment_snapshot": "snap-gap-assessment-v1-sha256-544e94cb08f1b0fb86d64372efd6bd869bca354e3c44f0734f0d573af9c48160",
  "source_gap_response_snapshot": "snap-gap-response-v1-sha256-eb578da5bb52690da8a385cb4d9f8f50aced380848dbb5d1b6d03ad1953c653f",
  "source_market_snapshot": "snap-market-dossier-v2-sha256-e6481fc131e14bd995628acc38e7b0dc5badb13b9d7c405ca5a01ecdfee7df4e",
  "source_provider_research_snapshot": null,
  "source_research_snapshot": "snap-market-sha256-018be6ecf73ffb038a260b4c09cdbfa9b6c083a5e42dd06679b80f814b785183",
  "state": "provider_evidence_required"
}
