{
  "as_of_date": "2026-08-13",
  "candidate_relation": "unknown",
  "candidate_support_state": "candidate_reported_match",
  "decision_basis_code": "gap_unknown",
  "done_when": "The relation is confirmed or marked unknown.",
  "draft_only": true,
  "eligible_provider_choices": [],
  "locale": "en",
  "no_external_action": true,
  "outcome_boundary": "not_an_interview_offer_salary_or_hiring_prediction",
  "privacy_boundary": "identity_free_structured_eligibility_only",
  "private_deliverable": "One structured response without free-form prose for the selected signal.",
  "public_vacancy_ordinal": "V2",
  "recommended_next_action": "confirm_gap_relation",
  "recurrence": "2/4",
  "schema_version": "career-next-action-eligibility-v1",
  "selected_provider_option_id": null,
  "selected_signal": "terraform",
  "selected_vacancy_id": "V-003",
  "source_alignment_snapshot": "snap-alignment-sha256-104d247a0d5a90a070292e1d102d79f1a6cc8de0c15ff9a9214298811f7af6eb",
  "source_dossier_snapshot": "snap-dossier-sha256-4421cc64f2bca782e998ab2f9488be928bf4f27a0e9bb9a706e0abdde0485b03",
  "source_gap_assessment_snapshot": "snap-gap-assessment-v1-sha256-a27cbf9e7fe0183decf695f17e7bf5ca80eb785e408e06d81ccbf499369f0cdc",
  "source_gap_response_snapshot": "snap-gap-response-v1-sha256-827714480e4e7f22f6164d83bdf6c3096b12b19ed816523b2393c597b6f3e64a",
  "source_market_snapshot": "snap-market-dossier-v2-sha256-e6481fc131e14bd995628acc38e7b0dc5badb13b9d7c405ca5a01ecdfee7df4e",
  "source_provider_research_snapshot": null,
  "source_research_snapshot": "snap-market-sha256-018be6ecf73ffb038a260b4c09cdbfa9b6c083a5e42dd06679b80f814b785183",
  "state": "insufficient_gap_evidence"
}
