{
  "as_of_date": "2026-08-13",
  "candidate_relation": "knowledge_gap",
  "candidate_support_state": "candidate_reported_match",
  "decision_basis_code": "knowledge_gap_recurrent_provider_selected",
  "done_when": "Cost, time, prerequisites, and maintenance are confirmed or marked unknown.",
  "draft_only": true,
  "eligible_provider_choices": [],
  "locale": "en",
  "no_external_action": true,
  "outcome_boundary": "not_an_interview_offer_salary_or_hiring_prediction",
  "privacy_boundary": "identity_free_structured_eligibility_only",
  "private_deliverable": "One private review of cost, time, prerequisites, and unknowns.",
  "public_vacancy_ordinal": "V2",
  "recommended_next_action": "research_provider_option",
  "recurrence": "2/4",
  "schema_version": "career-next-action-eligibility-v1",
  "selected_provider_option_id": "LP-003",
  "selected_signal": "terraform",
  "selected_vacancy_id": "V-003",
  "source_alignment_snapshot": "snap-alignment-sha256-104d247a0d5a90a070292e1d102d79f1a6cc8de0c15ff9a9214298811f7af6eb",
  "source_dossier_snapshot": "snap-dossier-sha256-4421cc64f2bca782e998ab2f9488be928bf4f27a0e9bb9a706e0abdde0485b03",
  "source_gap_assessment_snapshot": "snap-gap-assessment-v1-sha256-a0861dd039c0cd66db0b48e5f69338b7cd948b0005dd7a95c930497ba34e41a6",
  "source_gap_response_snapshot": "snap-gap-response-v1-sha256-80b6789e8877515de1d023f81cdf214bda34efeee6ef687757ca78737b054d74",
  "source_market_snapshot": "snap-market-dossier-v2-sha256-e6481fc131e14bd995628acc38e7b0dc5badb13b9d7c405ca5a01ecdfee7df4e",
  "source_provider_research_snapshot": "snap-provider-sha256-1a47017cdf515c2471fa476fedbfa67ca1a9eaf4ff19d8283cd604aa1bf73a31",
  "source_research_snapshot": "snap-market-sha256-018be6ecf73ffb038a260b4c09cdbfa9b6c083a5e42dd06679b80f814b785183",
  "state": "eligible"
}
