{
  "as_of_date": "2026-08-13",
  "candidate_relation": "proof_gap",
  "candidate_support_state": "candidate_reported_match",
  "decision_basis_code": "proof_gap_recurrent",
  "done_when": "The proof shows scope, action, and result without claiming unsupported production work.",
  "draft_only": true,
  "eligible_provider_choices": [],
  "locale": "en",
  "no_external_action": true,
  "outcome_boundary": "not_an_interview_offer_salary_or_hiring_prediction",
  "privacy_boundary": "identity_free_structured_eligibility_only",
  "private_deliverable": "One private, inspectable proof for the selected signal.",
  "public_vacancy_ordinal": "V2",
  "recommended_next_action": "build_bounded_proof",
  "recurrence": "2/4",
  "schema_version": "career-next-action-eligibility-v1",
  "selected_provider_option_id": null,
  "selected_signal": "terraform",
  "selected_vacancy_id": "V-003",
  "source_alignment_snapshot": "snap-alignment-sha256-104d247a0d5a90a070292e1d102d79f1a6cc8de0c15ff9a9214298811f7af6eb",
  "source_dossier_snapshot": "snap-dossier-sha256-4421cc64f2bca782e998ab2f9488be928bf4f27a0e9bb9a706e0abdde0485b03",
  "source_gap_assessment_snapshot": "snap-gap-assessment-v1-sha256-ad7ee06bce28931b9a04fa97ffc0885b9c9be438359a93975e4859e255f8ec87",
  "source_gap_response_snapshot": "snap-gap-response-v1-sha256-d9ade8f875a5b55a8fb75871e624d8f58a10de9ad02a8a4988948bc115777b39",
  "source_market_snapshot": "snap-market-dossier-v2-sha256-e6481fc131e14bd995628acc38e7b0dc5badb13b9d7c405ca5a01ecdfee7df4e",
  "source_provider_research_snapshot": null,
  "source_research_snapshot": "snap-market-sha256-018be6ecf73ffb038a260b4c09cdbfa9b6c083a5e42dd06679b80f814b785183",
  "state": "eligible"
}
