{
  "as_of_date": "2026-08-13",
  "candidate_relation": null,
  "candidate_support_state": null,
  "decision_basis_code": "selection_missing",
  "done_when": "The vacancy and signal belong to the same active vacancy.",
  "draft_only": true,
  "eligible_provider_choices": [],
  "locale": "en",
  "no_external_action": true,
  "outcome_boundary": "not_an_interview_offer_salary_or_hiring_prediction",
  "privacy_boundary": "identity_free_structured_eligibility_only",
  "private_deliverable": "One public Vn + signal pair chosen by you.",
  "public_vacancy_ordinal": null,
  "recommended_next_action": "select_target_vacancy_and_signal",
  "recurrence": null,
  "schema_version": "career-next-action-eligibility-v1",
  "selected_provider_option_id": null,
  "selected_signal": null,
  "selected_vacancy_id": null,
  "source_alignment_snapshot": "snap-alignment-sha256-104d247a0d5a90a070292e1d102d79f1a6cc8de0c15ff9a9214298811f7af6eb",
  "source_dossier_snapshot": "snap-dossier-sha256-4421cc64f2bca782e998ab2f9488be928bf4f27a0e9bb9a706e0abdde0485b03",
  "source_gap_assessment_snapshot": "snap-gap-assessment-v1-sha256-994fae580e4ab4f8a9f4256dca1bb6c54854c900b8754544f63b31d4acc62cdb",
  "source_gap_response_snapshot": "snap-gap-response-v1-sha256-23578b39f1958f91335cf98fb78b5ec61d5c8304b5c8361afca40589a9af2173",
  "source_market_snapshot": "snap-market-dossier-v2-sha256-e6481fc131e14bd995628acc38e7b0dc5badb13b9d7c405ca5a01ecdfee7df4e",
  "source_provider_research_snapshot": null,
  "source_research_snapshot": "snap-market-sha256-018be6ecf73ffb038a260b4c09cdbfa9b6c083a5e42dd06679b80f814b785183",
  "state": "selection_required"
}
