{
  "as_of_date": "2026-08-13",
  "candidate_relation": "supported",
  "candidate_support_state": "candidate_reported_match",
  "decision_basis_code": "candidate_supported",
  "done_when": "Cada afirmación está respaldada o marcada para confirmar u omitir.",
  "draft_only": true,
  "eligible_provider_choices": [],
  "locale": "es",
  "no_external_action": true,
  "outcome_boundary": "not_an_interview_offer_salary_or_hiring_prediction",
  "privacy_boundary": "identity_free_structured_eligibility_only",
  "private_deliverable": "Un borrador privado y verificable para la vacante elegida; no se envía.",
  "public_vacancy_ordinal": "V2",
  "recommended_next_action": "prepare_private_vacancy_packet",
  "recurrence": "2/5",
  "schema_version": "career-next-action-eligibility-v1",
  "selected_provider_option_id": null,
  "selected_signal": "terraform",
  "selected_vacancy_id": "V-003",
  "source_alignment_snapshot": "snap-alignment-sha256-cac631385f26e544adea7ce8a8aef267f8d1cfb9335792cd9278473087023f6e",
  "source_dossier_snapshot": "snap-dossier-sha256-1cc5d236dc6a805748612a7765895e94adb4c3250d325239a4a398797fdc18a1",
  "source_gap_assessment_snapshot": "snap-gap-assessment-v1-sha256-4465af79aa3cb7089cac6280a28a74340169e147d8ffc8b165565c6f38234919",
  "source_gap_response_snapshot": "snap-gap-response-v1-sha256-73c3405e171e08b02761d5a5e88916d152d5adbbe4461f19bb66c55c3e901803",
  "source_market_snapshot": "snap-market-dossier-v2-sha256-170c3b21b6d2343a35011f7b4bac3f24c8d22a0bf7d3847a300bb14bf8191487",
  "source_provider_research_snapshot": null,
  "source_research_snapshot": "snap-market-sha256-8273d3c23da3158584005569e48be00cb1a380c4d6d6d15b2c4f8d8464ffb924",
  "state": "insufficient_gap_evidence"
}
