{
  "as_of_date": "2026-08-13",
  "candidate_relation": "unknown",
  "candidate_support_state": "candidate_reported_match",
  "decision_basis_code": "gap_unknown",
  "done_when": "La relación queda confirmada o marcada como desconocida.",
  "draft_only": true,
  "eligible_provider_choices": [],
  "locale": "es",
  "no_external_action": true,
  "outcome_boundary": "not_an_interview_offer_salary_or_hiring_prediction",
  "privacy_boundary": "identity_free_structured_eligibility_only",
  "private_deliverable": "Una respuesta estructurada, sin prosa libre, para la señal elegida.",
  "public_vacancy_ordinal": "V2",
  "recommended_next_action": "confirm_gap_relation",
  "recurrence": "2/5",
  "schema_version": "career-next-action-eligibility-v1",
  "selected_provider_option_id": null,
  "selected_signal": "terraform",
  "selected_vacancy_id": "V-003",
  "source_alignment_snapshot": "snap-alignment-sha256-cac631385f26e544adea7ce8a8aef267f8d1cfb9335792cd9278473087023f6e",
  "source_dossier_snapshot": "snap-dossier-sha256-1cc5d236dc6a805748612a7765895e94adb4c3250d325239a4a398797fdc18a1",
  "source_gap_assessment_snapshot": "snap-gap-assessment-v1-sha256-b2bd7482c357dc13d72a11b2d700ab458b0617f233f204a655781dc600971548",
  "source_gap_response_snapshot": "snap-gap-response-v1-sha256-533f29f04d34612c0872a517d40615029f03dbfca729aecf5ea0877a22539068",
  "source_market_snapshot": "snap-market-dossier-v2-sha256-170c3b21b6d2343a35011f7b4bac3f24c8d22a0bf7d3847a300bb14bf8191487",
  "source_provider_research_snapshot": null,
  "source_research_snapshot": "snap-market-sha256-8273d3c23da3158584005569e48be00cb1a380c4d6d6d15b2c4f8d8464ffb924",
  "state": "insufficient_gap_evidence"
}
