{
  "as_of_date": "2026-08-13",
  "candidate_relation": "knowledge_gap",
  "candidate_support_state": "candidate_reported_match",
  "decision_basis_code": "provider_evidence_missing",
  "done_when": "Existe una fuente oficial vigente o la decisión permanece aplazada.",
  "draft_only": true,
  "eligible_provider_choices": [],
  "locale": "es",
  "no_external_action": true,
  "outcome_boundary": "not_an_interview_offer_salary_or_hiring_prediction",
  "privacy_boundary": "identity_free_structured_eligibility_only",
  "private_deliverable": "Una nota privada de la evidencia de proveedor que falta.",
  "public_vacancy_ordinal": "V2",
  "recommended_next_action": "no_learning_yet",
  "recurrence": "2/5",
  "schema_version": "career-next-action-eligibility-v1",
  "selected_provider_option_id": null,
  "selected_signal": "terraform",
  "selected_vacancy_id": "V-003",
  "source_alignment_snapshot": "snap-alignment-sha256-cac631385f26e544adea7ce8a8aef267f8d1cfb9335792cd9278473087023f6e",
  "source_dossier_snapshot": "snap-dossier-sha256-1cc5d236dc6a805748612a7765895e94adb4c3250d325239a4a398797fdc18a1",
  "source_gap_assessment_snapshot": "snap-gap-assessment-v1-sha256-b743a7d861d98b902e675b37ec12f13cc1770162378541e88b6ed4270b4a5619",
  "source_gap_response_snapshot": "snap-gap-response-v1-sha256-832ea9629175952d9fdce81f7b09b97753e71eb908da0c8800b08ad8304a1a6f",
  "source_market_snapshot": "snap-market-dossier-v2-sha256-170c3b21b6d2343a35011f7b4bac3f24c8d22a0bf7d3847a300bb14bf8191487",
  "source_provider_research_snapshot": null,
  "source_research_snapshot": "snap-market-sha256-8273d3c23da3158584005569e48be00cb1a380c4d6d6d15b2c4f8d8464ffb924",
  "state": "provider_evidence_required"
}
