{
  "as_of_date": "2026-08-13",
  "candidate_relation": "proof_gap",
  "candidate_support_state": "candidate_reported_match",
  "decision_basis_code": "proof_gap_recurrent",
  "done_when": "La prueba muestra alcance, acción y resultado sin afirmar producción no demostrada.",
  "draft_only": true,
  "eligible_provider_choices": [],
  "locale": "es",
  "no_external_action": true,
  "outcome_boundary": "not_an_interview_offer_salary_or_hiring_prediction",
  "privacy_boundary": "identity_free_structured_eligibility_only",
  "private_deliverable": "Una prueba privada e inspeccionable de la señal elegida.",
  "public_vacancy_ordinal": "V2",
  "recommended_next_action": "build_bounded_proof",
  "recurrence": "2/5",
  "schema_version": "career-next-action-eligibility-v1",
  "selected_provider_option_id": null,
  "selected_signal": "terraform",
  "selected_vacancy_id": "V-003",
  "source_alignment_snapshot": "snap-alignment-sha256-cac631385f26e544adea7ce8a8aef267f8d1cfb9335792cd9278473087023f6e",
  "source_dossier_snapshot": "snap-dossier-sha256-1cc5d236dc6a805748612a7765895e94adb4c3250d325239a4a398797fdc18a1",
  "source_gap_assessment_snapshot": "snap-gap-assessment-v1-sha256-64711a8d18acf55449da458ff7546287a1f8f8984bdfbf7b8e93d6284d6110bc",
  "source_gap_response_snapshot": "snap-gap-response-v1-sha256-5ddfd14cfe8e557c29a76bb458aecb8e164aca156e57ec549069e49e6b82e30f",
  "source_market_snapshot": "snap-market-dossier-v2-sha256-170c3b21b6d2343a35011f7b4bac3f24c8d22a0bf7d3847a300bb14bf8191487",
  "source_provider_research_snapshot": null,
  "source_research_snapshot": "snap-market-sha256-8273d3c23da3158584005569e48be00cb1a380c4d6d6d15b2c4f8d8464ffb924",
  "state": "eligible"
}
