{
  "as_of_date": "2026-08-13",
  "candidate_relation": "supported",
  "candidate_support_state": "candidate_reported_match",
  "decision_basis_code": "candidate_supported",
  "done_when": "Every claim is supported or marked to confirm or omit.",
  "draft_only": true,
  "eligible_provider_choices": [],
  "locale": "en",
  "no_external_action": true,
  "outcome_boundary": "not_an_interview_offer_salary_or_hiring_prediction",
  "privacy_boundary": "identity_free_structured_eligibility_only",
  "private_deliverable": "One private, verifiable draft for the selected vacancy; it is not sent.",
  "public_vacancy_ordinal": "V2",
  "recommended_next_action": "prepare_private_vacancy_packet",
  "recurrence": "2/4",
  "schema_version": "career-next-action-eligibility-v1",
  "selected_provider_option_id": null,
  "selected_signal": "terraform",
  "selected_vacancy_id": "V-003",
  "source_alignment_snapshot": "snap-alignment-sha256-104d247a0d5a90a070292e1d102d79f1a6cc8de0c15ff9a9214298811f7af6eb",
  "source_dossier_snapshot": "snap-dossier-sha256-4421cc64f2bca782e998ab2f9488be928bf4f27a0e9bb9a706e0abdde0485b03",
  "source_gap_assessment_snapshot": "snap-gap-assessment-v1-sha256-782c8f98722261ce2e07c7336371f35bb01daea516789ead75b355e00283e1e7",
  "source_gap_response_snapshot": "snap-gap-response-v1-sha256-692284cd8d4c4b2540094b1064c585de57bfce76a9f9f134ca246e43c8e207f2",
  "source_market_snapshot": "snap-market-dossier-v2-sha256-e6481fc131e14bd995628acc38e7b0dc5badb13b9d7c405ca5a01ecdfee7df4e",
  "source_provider_research_snapshot": null,
  "source_research_snapshot": "snap-market-sha256-018be6ecf73ffb038a260b4c09cdbfa9b6c083a5e42dd06679b80f814b785183",
  "state": "insufficient_gap_evidence"
}
