{
  "as_of_date": "2026-08-13",
  "candidate_relation": "proof_gap",
  "candidate_support_state": "candidate_reported_match",
  "decision_basis_code": "recurrence_below_two",
  "done_when": "Cada afirmación está respaldada o marcada para confirmar u omitir.",
  "draft_only": true,
  "eligible_provider_choices": [],
  "locale": "es",
  "no_external_action": true,
  "outcome_boundary": "not_an_interview_offer_salary_or_hiring_prediction",
  "privacy_boundary": "identity_free_structured_eligibility_only",
  "private_deliverable": "Un borrador privado y verificable para la vacante elegida; no se envía.",
  "public_vacancy_ordinal": "V1",
  "recommended_next_action": "prepare_private_vacancy_packet",
  "recurrence": "1/5",
  "schema_version": "career-next-action-eligibility-v1",
  "selected_provider_option_id": null,
  "selected_signal": "terraform",
  "selected_vacancy_id": "V-003",
  "source_alignment_snapshot": "snap-alignment-sha256-d5e986addd109b60029cf236e66c5b40a2cfe084214d5d3326b543aa95390842",
  "source_dossier_snapshot": "snap-dossier-sha256-1cc5d236dc6a805748612a7765895e94adb4c3250d325239a4a398797fdc18a1",
  "source_gap_assessment_snapshot": "snap-gap-assessment-v1-sha256-e597c3f5f20a429cd027eadd22e9df588af6064a82e42a76fe4cbef0792528b6",
  "source_gap_response_snapshot": "snap-gap-response-v1-sha256-1638a40ff05033acd904653e4ea812e29a659f57786cc59d400ff1ade2a1b0ae",
  "source_market_snapshot": "snap-market-dossier-v2-sha256-598fce30154336f39eceb80e0a5227c260cbddf64718b1cc142a7d4ae598214e",
  "source_provider_research_snapshot": null,
  "source_research_snapshot": "snap-market-sha256-85efa33d3d58256da22fe860d35c40933d02109873483096a7bbf6f4aa405729",
  "state": "insufficient_recurrence"
}
