{
  "as_of_date": "2026-08-13",
  "candidate_relation": "terminology_gap",
  "candidate_support_state": "candidate_reported_match",
  "decision_basis_code": "terminology_gap_recurrent",
  "done_when": "The query returns dated evidence or is recorded as unavailable.",
  "draft_only": true,
  "eligible_provider_choices": [],
  "locale": "en",
  "no_external_action": true,
  "outcome_boundary": "not_an_interview_offer_salary_or_hiring_prediction",
  "privacy_boundary": "identity_free_structured_eligibility_only",
  "private_deliverable": "One private search using the selected terminology; no application is submitted.",
  "public_vacancy_ordinal": "V2",
  "recommended_next_action": "run_role_search_experiment",
  "recurrence": "2/4",
  "schema_version": "career-next-action-eligibility-v1",
  "selected_provider_option_id": null,
  "selected_signal": "terraform",
  "selected_vacancy_id": "V-003",
  "source_alignment_snapshot": "snap-alignment-sha256-104d247a0d5a90a070292e1d102d79f1a6cc8de0c15ff9a9214298811f7af6eb",
  "source_dossier_snapshot": "snap-dossier-sha256-4421cc64f2bca782e998ab2f9488be928bf4f27a0e9bb9a706e0abdde0485b03",
  "source_gap_assessment_snapshot": "snap-gap-assessment-v1-sha256-23fd86d46a8e56304e4d72c1a08074ac3600ee56ffe27f583d4f536d66a1f767",
  "source_gap_response_snapshot": "snap-gap-response-v1-sha256-1b42d24c658f3bd88f0cba8b281ef19daa80c24929b38e431722381573f7c88a",
  "source_market_snapshot": "snap-market-dossier-v2-sha256-e6481fc131e14bd995628acc38e7b0dc5badb13b9d7c405ca5a01ecdfee7df4e",
  "source_provider_research_snapshot": null,
  "source_research_snapshot": "snap-market-sha256-018be6ecf73ffb038a260b4c09cdbfa9b6c083a5e42dd06679b80f814b785183",
  "state": "eligible"
}
