{
  "as_of_date": "2026-08-13",
  "candidate_relation": null,
  "candidate_support_state": null,
  "decision_basis_code": "market_unavailable",
  "done_when": "A current official source exists or the decision remains deferred.",
  "draft_only": true,
  "eligible_provider_choices": [],
  "locale": "en",
  "no_external_action": true,
  "outcome_boundary": "not_an_interview_offer_salary_or_hiring_prediction",
  "privacy_boundary": "identity_free_structured_eligibility_only",
  "private_deliverable": "One private note of the missing provider evidence.",
  "public_vacancy_ordinal": null,
  "recommended_next_action": "no_learning_yet",
  "recurrence": null,
  "schema_version": "career-next-action-eligibility-v1",
  "selected_provider_option_id": null,
  "selected_signal": null,
  "selected_vacancy_id": null,
  "source_alignment_snapshot": "snap-alignment-sha256-1ffe4f01350d075a9c385a39ffa59adc7ae8c90d1b8062c5b2b42409b5077f32",
  "source_dossier_snapshot": "snap-dossier-sha256-4421cc64f2bca782e998ab2f9488be928bf4f27a0e9bb9a706e0abdde0485b03",
  "source_gap_assessment_snapshot": "snap-gap-assessment-v1-sha256-3f431ab01116b35c94e8365c76f61f845d89cabc9b089182e0bfe6b9c705296c",
  "source_gap_response_snapshot": "snap-gap-response-v1-sha256-ac9520cb1145a9f72557c3fe22001f5046877cd2ebe3b1b590e4193361792731",
  "source_market_snapshot": "snap-market-dossier-v2-sha256-68dc82c8d78e7ab288a441f338ad7079f71c20c23582f46a84b344c71e940519",
  "source_provider_research_snapshot": null,
  "source_research_snapshot": "snap-market-sha256-dde0cbcf83608e3b45c881e267d5c0bcd5a2bfd6c37caf6f45eb331bd131e587",
  "state": "unavailable"
}
