{
  "as_of_date": "2026-08-13",
  "candidate_relation": "proof_gap",
  "candidate_support_state": "candidate_reported_match",
  "decision_basis_code": "recurrence_below_two",
  "done_when": "Every claim is supported or marked to confirm or omit.",
  "draft_only": true,
  "eligible_provider_choices": [],
  "locale": "en",
  "no_external_action": true,
  "outcome_boundary": "not_an_interview_offer_salary_or_hiring_prediction",
  "privacy_boundary": "identity_free_structured_eligibility_only",
  "private_deliverable": "One private, verifiable draft for the selected vacancy; it is not sent.",
  "public_vacancy_ordinal": "V1",
  "recommended_next_action": "prepare_private_vacancy_packet",
  "recurrence": "1/4",
  "schema_version": "career-next-action-eligibility-v1",
  "selected_provider_option_id": null,
  "selected_signal": "terraform",
  "selected_vacancy_id": "V-003",
  "source_alignment_snapshot": "snap-alignment-sha256-5b9ae602797335597b38e6522f2fb2701709c0d977516a5d111f316b6d3eb436",
  "source_dossier_snapshot": "snap-dossier-sha256-4421cc64f2bca782e998ab2f9488be928bf4f27a0e9bb9a706e0abdde0485b03",
  "source_gap_assessment_snapshot": "snap-gap-assessment-v1-sha256-f716c6d15476415526664138a99b8edb8b1cbd6ba31ba130410cdae62c384d45",
  "source_gap_response_snapshot": "snap-gap-response-v1-sha256-1828700ff6022034cb21e3bd42c43f28a926a6198b6b65efab1105aa4cb22d4f",
  "source_market_snapshot": "snap-market-dossier-v2-sha256-180784acf989a26f7ab33bba5ceeecf45e90382e631a574a9b1e154171b8121b",
  "source_provider_research_snapshot": null,
  "source_research_snapshot": "snap-market-sha256-c9502f56899aa606eadd274f11cf9d99a0afadf9aa6049afd99a32e4a221e7d1",
  "state": "insufficient_recurrence"
}
