{
  "as_of_date": "2026-08-13",
  "candidate_relation": null,
  "candidate_support_state": null,
  "decision_basis_code": "market_unavailable",
  "done_when": "Existe una fuente oficial vigente o la decisión permanece aplazada.",
  "draft_only": true,
  "eligible_provider_choices": [],
  "locale": "es",
  "no_external_action": true,
  "outcome_boundary": "not_an_interview_offer_salary_or_hiring_prediction",
  "privacy_boundary": "identity_free_structured_eligibility_only",
  "private_deliverable": "Una nota privada de la evidencia de proveedor que falta.",
  "public_vacancy_ordinal": null,
  "recommended_next_action": "no_learning_yet",
  "recurrence": null,
  "schema_version": "career-next-action-eligibility-v1",
  "selected_provider_option_id": null,
  "selected_signal": null,
  "selected_vacancy_id": null,
  "source_alignment_snapshot": "snap-alignment-sha256-b3890577582fbd214dec63eb8bbc71ca69660aecb8210a450ff4b4a1208055ac",
  "source_dossier_snapshot": "snap-dossier-sha256-1cc5d236dc6a805748612a7765895e94adb4c3250d325239a4a398797fdc18a1",
  "source_gap_assessment_snapshot": "snap-gap-assessment-v1-sha256-194e6dba46a6610f626d4eb8ae61fcb1799ab236a0a469f2eee37aa30718c1ae",
  "source_gap_response_snapshot": "snap-gap-response-v1-sha256-cb2cbf8146ab1aaabf02996a4e2e91cd1511ee9899cb720d895b23460a4e9f18",
  "source_market_snapshot": "snap-market-dossier-v2-sha256-b8a6838f7259b16c265174d6da2f8d3da7f16df5d510098451233e436c0982bf",
  "source_provider_research_snapshot": null,
  "source_research_snapshot": "snap-market-sha256-c7b20fd2df65c1ff2861b1db899e661142ea641bd5c270889883fdedac5f22ce",
  "state": "unavailable"
}
